{"assumptions":["PBR-HOST-AX-002","PBR-LINUX-AX-001","PBR-TOOLCHAIN-AX-003"],"boundary":{"cgroup":{"inode":"14","mount_id":"13"},"execution_id":"00112233-4455-4677-8899-aabbccddeeff","policy_sha256":"0303030303030303030303030303030303030303030303030303030303030303","state":"installed"},"command":{"arguments_sha256":"0909090909090909090909090909090909090909090909090909090909090909","executable":{"mode":416,"role":"runtime-executable","sha256":"0606060606060606060606060606060606060606060606060606060606060606","size":"6"},"loader":{"mode":416,"role":"runtime-loader-executable","sha256":"0707070707070707070707070707070707070707070707070707070707070707","size":"7"},"working_directory":{"mode":416,"role":"working-directory","sha256":"0808080808080808080808080808080808080808080808080808080808080808","size":"8"}},"eligibility":{"reasons":[],"status":"reusable"},"environment":["LANG","PATH"],"execution_id":"00112233-4455-4677-8899-aabbccddeeff","inputs":[{"mode":416,"role":"runtime-library","sha256":"0a0a0a0a0a0a0a0a0a0a0a0a0a0a0a0a0a0a0a0a0a0a0a0a0a0a0a0a0a0a0a0a","size":"10"},{"mode":416,"role":"project-input","sha256":"0b0b0b0b0b0b0b0b0b0b0b0b0b0b0b0b0b0b0b0b0b0b0b0b0b0b0b0b0b0b0b0b","size":"11"}],"observations":{"clock":"linux-monotonic","finished_ns":"16","started_ns":"15"},"outcome":{"code":0,"kind":"exited"},"output_root":{"mode":416,"role":"output-root","sha256":"0c0c0c0c0c0c0c0c0c0c0c0c0c0c0c0c0c0c0c0c0c0c0c0c0c0c0c0c0c0c0c0c","size":"12"},"outputs":[{"mode":416,"role":"output-artifact","sha256":"1313131313131313131313131313131313131313131313131313131313131313","size":"19"}],"plan":{"id":"benchmark.plan","normalized":{"mode":416,"role":"normalized-plan","sha256":"0202020202020202020202020202020202020202020202020202020202020202","size":"2"},"source":{"mode":416,"role":"execution-plan","sha256":"0101010101010101010101010101010101010101010101010101010101010101","size":"1"}},"platform":{"architecture":"x86_64","cgroup_controllers":["memory","pids"],"kernel_release":"6.12.0-benchmark","landlock_abi":6,"operating_system":"linux","seccomp_features":["log","tsync"]},"policy":{"identity":{"mode":416,"role":"compiled-policy","sha256":"0303030303030303030303030303030303030303030303030303030303030303","size":"3"},"model_version":"proofbound-runtime-linux-policy/1"},"producer":{"mode":416,"role":"runtime-binary","sha256":"0404040404040404040404040404040404040404040404040404040404040404","size":"4"},"product_version":"0.1.0","runtime":{"launcher":{"mode":416,"role":"launcher-binary","sha256":"0505050505050505050505050505050505050505050505050505050505050505","size":"5"},"runtime":{"mode":416,"role":"runtime-binary","sha256":"0404040404040404040404040404040404040404040404040404040404040404","size":"4"}},"schema":"proofbound-runtime-receipt/1","streams":{"stderr":{"artifact":{"mode":416,"role":"standard-error","sha256":"1212121212121212121212121212121212121212121212121212121212121212","size":"18"},"capture":"complete"},"stdout":{"artifact":{"mode":416,"role":"standard-output","sha256":"1111111111111111111111111111111111111111111111111111111111111111","size":"17"},"capture":"complete"}},"trusted_computing_base":[{"identity":"host-hardware-firmware:benchmark-fixture","role":"host-hardware-firmware"},{"identity":"linux-kernel:benchmark-fixture","role":"linux-kernel"},{"identity":"landlock:benchmark-fixture","role":"landlock"},{"identity":"seccomp:benchmark-fixture","role":"seccomp"},{"identity":"cgroup-v2:benchmark-fixture","role":"cgroup-v2"},{"identity":"no-new-privileges:benchmark-fixture","role":"no-new-privileges"},{"identity":"filesystem:benchmark-fixture","role":"filesystem"},{"identity":"runtime-binary:benchmark-fixture","role":"runtime-binary"},{"identity":"launcher-binary:benchmark-fixture","role":"launcher-binary"},{"identity":"rust-toolchain:benchmark-fixture","role":"rust-toolchain"},{"identity":"cryptographic-digest:benchmark-fixture","role":"cryptographic-digest"},{"identity":"runtime-executable:benchmark-fixture","role":"runtime-executable"},{"identity":"runtime-loader-executable:benchmark-fixture","role":"runtime-loader-executable"},{"identity":"runtime-library:benchmark-fixture","role":"runtime-library"}]}
